{
  "$schema": "./schemas/template-contract.schema.json",
  "templateName": "HB Standard Project Site Template",
  "templateFamily": "Project Sites",
  "templateVersion": "1.0.0-proposed",
  "phase": "Phase 1 Step 5 — full extraction gate closed",
  "source": {
    "contract": "docs/architecture/blueprint/sp-project-control-center/Standard_Project_Site_Template_Contract.md",
    "blueprint": "docs/architecture/blueprint/sp-project-control-center/HB_Project_Control_Center_Target_Architecture_Blueprint.md",
    "phase0Closeout": "docs/architecture/blueprint/sp-project-control-center/phase-0/Phase_0_Step_2_Closeout_Report.md"
  },
  "status": {
    "readiness": "scaffold-only",
    "fullExtractionComplete": true,
    "containsNewArchitectureDecisions": false
  },
  "fieldMaps": {
    "phase": "Phase 1 Step 3 field consolidation",
    "directory": "./fields/",
    "readme": "./fields/README.md",
    "commonFields": "./fields/common-fields.json",
    "objectCatalogDisposition": "./fields/object-catalog-field-disposition.json",
    "familyDependencies": "./fields/family-field-dependencies.json",
    "families": {
      "template-manifest": "./fields/families/template-manifest.fields.json",
      "settings": "./fields/families/settings.fields.json",
      "permissions": "./fields/families/permissions.fields.json",
      "site": "./fields/families/site.fields.json",
      "pages": "./fields/families/pages.fields.json",
      "libraries": "./fields/families/libraries.fields.json",
      "lists": "./fields/families/lists.fields.json",
      "modules": "./fields/families/modules.fields.json",
      "workflows": "./fields/families/workflows.fields.json",
      "integrations": "./fields/families/integrations.fields.json",
      "site-health": "./fields/families/site-health.fields.json",
      "provisioning-validation": "./fields/families/provisioning-validation.fields.json"
    },
    "notes": "Field consolidation artifacts; schema population for the 12 remaining families occurs in Phase 1 Step 4. The 12 family schemas under schemas/families/ remain skeletons."
  },
  "families": {
    "template-manifest": {
      "schema": "./schemas/families/template-manifest.schema.json",
      "status": "populated",
      "notes": "Phase 1 Step 4 Wave 1 — populated. Template identity, version, ownership, supported ProjectStage/ProjectType/ProjectStatus enum bindings, source traceability, and effective date. mvp_status canonical (VR-24). No secrets (VR-13)."
    },
    "enums": {
      "schema": "./schemas/families/enums.schema.json",
      "status": "populated",
      "notes": "Phase 1 Step 2 — populated. Canonical enum sets defined: ProjectType, ProjectStage, ProjectStatus, DecisionClosureStatus (mvp_status), SiteHealthSeverity, RepairAutomationTier, EnforcementLayer, ValidationRuleCategory. Anti-regression tokens confined to forbiddenValues arrays. The 12 untouched family skeletons retain temporary scaffold-local mvp_status shorthand to be reconciled when each family is populated in Phase 1 Step 3 / Step 4."
    },
    "settings": {
      "schema": "./schemas/families/settings.schema.json",
      "status": "populated",
      "notes": "Phase 1 Step 4 Wave 1 — populated. §10 settings sections; three-form ProcoreCompanyId (default 5280, configuration not secret, VR-10); M365/Teams posture frozen (VR-28); DMSA auth posture; backend-only secret storage (VR-13); §15.2 Project Site Configuration bucketing. mvp_status canonical (VR-24)."
    },
    "permissions": {
      "schema": "./schemas/families/permissions.schema.json",
      "status": "populated",
      "notes": "Phase 1 Step 4 Wave 1 — populated. Permission templates (10 MVP + 3 Deferred external), central Entra groups, project-local SharePoint groups, phase-based access manager bindings (VR-27, VR-30), Procore mapping owner (PM/PX, never PA — VR-11), Procore directory comparison read-only (VR-15), external-user deferral (VR-18). mvp_status canonical (VR-24)."
    },
    "site": {
      "schema": "./schemas/families/site.schema.json",
      "status": "populated",
      "notes": "Phase 1 Step 4 Wave 1 — populated. Project identity, naming (§5/§5.6), URL conventions, §6.1 required + §6.2 optional metadata, ProjectStage/ProjectStatus/ProjectType enum bindings (VR-01–VR-06, VR-09, VR-29), archive behavior, and Sage Intacct cross-reference (VR-14). mvp_status canonical (VR-24)."
    },
    "pages": {
      "schema": "./schemas/families/pages.schema.json",
      "status": "populated",
      "notes": "Phase 1 Step 4 Wave 2 — populated. 17 §13 standard pages (9 MVP + 8 Future): pageUrl pattern under /SitePages/, embeddedModule references (VR-26), defaultOrder 1–17, visibility enum, mvpStatus canonical (VR-24). PCC-facing pages only — never native SharePoint admin/edit/settings surfaces (VR-17)."
    },
    "libraries": {
      "schema": "./schemas/families/libraries.schema.json",
      "status": "populated",
      "notes": "Phase 1 Step 4 Wave 2 — populated. 12 §14.1 libraries (8 MVP/Required + 3 Optional/Future + 99_Archive). Sync policy enum (§14.2), folder permissions policy (§14.5; VR-17), governed sync exception (§14.5A), readOnlyOnStatus on Closed/Archived (VR-09, VR-29), seedRule keyed strictly on ProjectType (VR-08). No-full-Procore-mirror posture preserved (VR-16; Contract P-10). mvp_status canonical (VR-24)."
    },
    "lists": {
      "schema": "./schemas/families/lists.schema.json",
      "status": "populated",
      "notes": "Phase 1 Step 4 Wave 2 — populated. List-level shape covering §15.2 governance lists, §15.3–§15.11 operational lists, with §16.1 baseline columns (Status §16.2, Priority §16.3) inherited by every operational list. Per-list field expansion bounded to requiredFields/optionalFields names; full per-list schemas land downstream as needed. readOnlyOnStatus keys on ProjectStatus (Archived only as Status). Lookups bound by VR-25; owningModule by VR-26; seedRule strictly on ProjectType (VR-08). mvp_status canonical (VR-24)."
    },
    "modules": {
      "schema": "./schemas/families/modules.schema.json",
      "status": "populated",
      "notes": "Phase 1 Step 4 Wave 2 — populated. 20 §8.1 modules (8 MVP + 12 Later, plus governance Settings/Site Health entry). visibilityByStage keyed strictly on the six ProjectStage values per VR-07; ProjectType never used as a visibility key; 'Archived' never appears in projectStage enum. verticalSeeding (when present) keyed strictly on ProjectType per VR-08. HBI Assistant carries mvpStatus 'Deferred' per VR-19. mvp_status canonical (VR-24)."
    },
    "workflows": {
      "schema": "./schemas/families/workflows.schema.json",
      "status": "populated",
      "notes": "Phase 1 Step 4 Wave 3 — populated. 8 §17.1–§17.8 seeded workflow templates (5 MVP + 3 Deferred). Responsibility / due-date / evidence / status fields plus stage-gated transitions; ProjectStatus archive behavior bound by VR-09. seedRule keyed strictly on ProjectType (VR-08). Owner Contract Matrix, Subcontractor Scorecard, Lessons Learned carry mvpStatus 'Deferred'. mvp_status canonical (VR-24)."
    },
    "integrations": {
      "schema": "./schemas/families/integrations.schema.json",
      "status": "populated",
      "notes": "Phase 1 Step 4 Wave 3 — populated. 8 §18.0 integrations (Procore, Sage Intacct, Compass, Document Crunch, Adobe Sign, Cupix, Teams, Outlook). Procore boundary hard-encoded: noFullProcoreMirror / noDirectSpfxToProcore / noProcoreSecrets / procoreDirectoryComparison_ReadOnly / procoreWriteback_Deferred all const true. ProcoreCompanyId default '5280', three-form contract, configuration not secret (VR-10, VR-13). Sage Intacct = accounting book of record (VR-14); Procore = operational. PCC does not become a financial book of record. OC-17 (Procore Object Link Records) and OC-18 (Procore Curated Summary Records) optional-only placeholder fields; no full Procore canonical model (VR-16 / Contract P-10). mvp_status canonical (VR-24)."
    },
    "site-health": {
      "schema": "./schemas/families/site-health.schema.json",
      "status": "populated",
      "notes": "Phase 1 Step 4 Wave 3 — populated. 20+ named §19.1 checks; severity (§19.3 canonical 5-value enum, VR-21); repair tier (§19A canonical 4-value enum, VR-22); auditTrail with sanitized entries — beforeAuditState / afterAuditState are redacted compact-JSON strings, no raw payload or secrets (VR-13, VR-17). Site Health depends on every provisioned object family. mvp_status canonical (VR-24)."
    },
    "provisioning-validation": {
      "schema": "./schemas/families/provisioning-validation.schema.json",
      "status": "populated",
      "notes": "Phase 1 Step 4 Wave 3 — populated. Validation/audit record schema for the §20.1 15-stage checklist (plus Procore sub-stages 12A–12F) and §20.2 record shape. Validates record SHAPE only — no provisioning runtime implementation produced in Phase 1. rollbackRef optional and Deferred beyond MVP. Stage 15 includes the no-Procore-secret-found check (R4). VR-17, VR-23. mvp_status canonical (VR-24)."
    },
    "validation-rules": {
      "schema": "./schemas/families/validation-rules.schema.json",
      "status": "populated",
      "notes": "Phase 1 Step 2 — populated. 13 rule categories, 8 enforcement layers, and the 30 initial rules (VR-01 through VR-30) extracted verbatim from the Phase 0 Step 2 Validation Rule Table Plan. Cross-layer rules carry participating-layer lists; JSON Schema alone does not enforce runtime behavior. Rules are append-only as later Phase 1 steps surface additional bindings."
    }
  }
}
